,feature_classification,feature_end,feature_length,feature_start,feature_subtype_index,feature_type,feature_type_index
0,Exon in a ncRNA,128221962,2334.0,128219628,1.0,Exon,1
0,Splice Junction Exon in a ncRNA to Splice Junction Exon in a ncRNA to Intron in a ncRNA,128221962,,128221962,,Splice Junction ,1
1,Splice Junction Splice Junction Exon in a ncRNA to Intron in a ncRNA to Intron in a ncRNA,128221962,,128221962,,Splice Junction ,2
1,Splice Junction Exon in a ncRNA to Intron in a ncRNA,128221962,,128221962,,Splice Junction ,1
2,Intron in a ncRNA,128231053,9091.0,128221962,1.0,Intron,1
2,Splice Junction Intron in a ncRNA to Splice Junction Intron in a ncRNA to Exon in a ncRNA,128231053,,128231053,,Splice Junction ,3
3,Splice Junction Intron in a ncRNA to Exon in a ncRNA,128231054,,128231053,,Splice Junction ,2
3,Splice Junction Splice Junction Intron in a ncRNA to Exon in a ncRNA to Exon in a ncRNA,128231054,,128231054,,Splice Junction ,4
4,Exon in a ncRNA,128231333,279.0,128231054,2.0,Exon,2
