,feature_classification,feature_end,feature_length,feature_start,feature_subtype_index,feature_type,feature_type_index
0,Exon in a ncRNA,73423744,2308.0,73421436,1.0,Exon,1
0,Splice Junction Exon in a ncRNA to Splice Junction Exon in a ncRNA to Intron in a ncRNA,73423744,,73423744,,Splice Junction ,1
1,Splice Junction Splice Junction Exon in a ncRNA to Intron in a ncRNA to Intron in a ncRNA,73423744,,73423744,,Splice Junction ,2
1,Splice Junction Exon in a ncRNA to Intron in a ncRNA,73423744,,73423744,,Splice Junction ,1
2,Intron in a ncRNA,73461766,38022.0,73423744,1.0,Intron,1
2,Splice Junction Intron in a ncRNA to Splice Junction Intron in a ncRNA to Exon in a ncRNA,73461766,,73461766,,Splice Junction ,3
3,Splice Junction Intron in a ncRNA to Exon in a ncRNA,73461767,,73461766,,Splice Junction ,2
3,Splice Junction Splice Junction Intron in a ncRNA to Exon in a ncRNA to Exon in a ncRNA,73461767,,73461767,,Splice Junction ,4
4,Exon in a ncRNA,73461983,216.0,73461767,2.0,Exon,2
