,feature_classification,feature_end,feature_length,feature_start,feature_subtype_index,feature_type,feature_type_index
0,Exon in a ncRNA,7982,396.0,7586,1.0,Exon,1
0,Splice Junction Exon in a ncRNA to Splice Junction Exon in a ncRNA to Intron in a ncRNA,7982,,7982,,Splice Junction ,1
1,Splice Junction Splice Junction Exon in a ncRNA to Intron in a ncRNA to Intron in a ncRNA,7982,,7982,,Splice Junction ,2
1,Splice Junction Exon in a ncRNA to Intron in a ncRNA,7982,,7982,,Splice Junction ,1
2,Intron in a ncRNA,15502,7520.0,7982,1.0,Intron,1
2,Splice Junction Intron in a ncRNA to Splice Junction Intron in a ncRNA to Exon in a ncRNA,15502,,15502,,Splice Junction ,3
3,Splice Junction Intron in a ncRNA to Exon in a ncRNA,15503,,15502,,Splice Junction ,2
3,Splice Junction Splice Junction Intron in a ncRNA to Exon in a ncRNA to Exon in a ncRNA,15503,,15503,,Splice Junction ,4
4,Exon in a ncRNA,15888,385.0,15503,2.0,Exon,2
